"URL","Versions","Traffic rank","IP country","IP region","Language","Email address","Email address (verified)","Email address (safe)","Phone number","Skype","WhatsApp","Twitter","Facebook","Instagram","GitHub","TikTok","YouTube","Pinterest","LinkedIn","Owler","Title","Description","Copyright","Copyright year","Responsive","schema.org types","Cert organisation","Cert country","Cert state","Cert locality","Cert issuer","Cert protocol","Cert expiry","SPF record","DMARC record","SSL/TLS enabled","Google Analytics","Google AdSense","Medianet","Facebook","Optimizely","Company name","Inferred company name","Industry","About","Locations","Company size","Company type","Company founded","People"
"https://www.upwork.com","1.5.9","3382913","US","","EN ; EN-US ; NL ; RU ; ar ; ar-EG ; ar-aa ; ar-sa ; az ; be-BY","info@upwork.com ; press@upwork.com ; partners@upwork.com ; investor@upwork.com ; accommodation@upwork.com","info@upwork.com ; press@upwork.com ; partners@upwork.com ; investor@upwork.com ; accommodation@upwork.com","","","","","","","","","","","","","","","","","","TRUE","","Upwork Global Inc.","","","Mountain View","DigiCert SHA2 High Assurance Server CA","TLS 1.3","1651665600","","","TRUE","","","","","","","Upwork Global Inc.","","","","","","",""
"https://angular.io","","706308","US","","NL ; ar ; ar-ae ; az ; bg ; bn ; ca ; cn ; cs ; cy","","","","","","","https://www.twitter.com/angular","","","","","https://www.youtube.com/angular","","https://www.linkedin.com/company/pinchmeup ; https://www.linkedin.com/company/angular-developer","","Angular - Request for document failed","","Super-powered by Google ©2010-2022.","2010","TRUE","","","","","","GTS CA 1D4","TLS 1.3","1647710897","TRUE","TRUE","TRUE","","","","","","Angular","ANGULAR","Computer Software","n/a","El Paso, Texas ; Los Angeles Dr, El Paso, Texas 79902, US","1,001-5,000 employees","Self-Employed","2016","Sagar jagdale -- Developer ; Francesco Roberto Pirri -- Jr Front-End Developer ; Array Legion -- Author | Influencer | blogger | C. E. O Array spot media |web developer| programmer with React | ; Jonathan Tena -- Ethical Hacker"
"https://ap.www.namecheap.com","1.3.13 ; 1.5.5","692254","US","","AR-ar ; ES ; GB ; ar ; ar-AE ; ar-EG ; ar-SA ; ar-sa ; az ; bn","nvprivacy@namecheap.com ; dpo@namecheap.com ; support@namecheap.com ; legal@namecheap.com","","","","","","https://www.twitter.com/namecheap","https://www.facebook.com/NameCheap","https://www.instagram.com/namecheap","","","","https://www.pinterest.com/namecheap","","","Buy a domain name - Register cheap domain names from $0.99 - Namecheap","Register domain names at Namecheap. Buy cheap domain names and enjoy 24/7 support. With over 13 million domains under management, you know you’re in good hands.","copyright © 2000–2021 Namecheap, Inc.","2000","TRUE","FAQPage ; Question ; Answer ; Organization","","","","","Sectigo ECC Extended Validation Secure Server CA","TLS 1.2","1671321599","TRUE","TRUE","TRUE","","","","","","","NAMECHEAP","","","","","","",""
"https://miro.com","1.6.9 ; 1.8.2","597467","US","","DE ; EN ; PL-pl ; RU ; SR ; TH ; ar ; bg ; bg-BG ; bn","welcome@miro.com ; privacy@miro.com ; legal@miro.com ; miroverse@miro.com ; info@miro.com ; welcome@miro.com ; Oliver Raskin <oliver@miro.com>","info@miro.com ; welcome@miro.com ; Oliver Raskin <oliver@miro.com>","Oliver Raskin <oliver@miro.com>","","","","https://www.twitter.com/mirohq","https://www.facebook.com/TryMiro","https://www.instagram.com/mirohq","","","","","https://www.linkedin.com/company/mirohq ; https://www.linkedin.com/company/neurotech-mindmap","","The Visual Collaboration Platform for Every Team | Miro","Scalable, secure, cross-device and enterprise-ready team collaboration whiteboard for distributed teams. Join 30M+ users from around the world.","© 2022 Miro","2022","TRUE","","","","","","Amazon","TLS 1.2","1672876799","TRUE","TRUE","FALSE","","","","","","Miro","MIRO","Computer Software","With more than 30M + users (and 99% of the Fortune 100), Miro is the online collaborative whiteboard platform that enables distributed teams to work effectively together, from running brainstorming sessions and workshops to planning projects, from designing new products and services to facilitating agile ceremonies.","San Francisco, California ; 535 Mission St, San Francisco, California 94105, US","1,001-5,000 employees","Privately Held","2011","Oliver Raskin -- ; Peter Boersma -- DesignOps Manager at Miro. Process enthusiast, design leader, and UX strategist. ; Todd Rice -- CX Design Lead @Volkswagen + Facilitator Advisory Panel @Miro + Founder @Boogli ; Paul D'Arcy -- CMO at Miro"
"https://www.cricbuzz.com","1.8.0","570028","","","","","","","","","","","","","","","","","https://www.linkedin.com/company/cricbuzz.com ; https://www.linkedin.com/company/cricfans","","","","","","","","","","","","","","","","","TRUE","","","","","","Cricbuzz.com","","Spectator Sports","A cricket website that started as the provider of the fastest (and it really IS the fastest) ball-by-ball commentary for every major cricket match in the world. Its speed on the commentary has now reached a level where it is at par with the live telecast of the match, but along with commentary, the website has also started developing its own content - with features, write-ups, and up-to-date news from around the cricketing world.","Bangalore, Karnataka ; No. 190-B, 1st Floor, HN Plaza,, 100 Ft Ring road, BSK 3rd Stage, Bangalore, Karnataka 560085, IN","51-200 employees","Privately Held","","Joy Bhattacharjya -- ; Piyush Agrawal -- Founder & Director, Media Sales at Cricbuzz.com ; Sourabh Khemalapure -- Video Operations Manager at Cricbuzz.com ; Kritika Naidu -- Journalist, Content writer"
"https://m.blog.naver.com","1.5.0","542028","","","EN ; KO ; KR ; ar ; az ; ca ; cy ; da ; en ; en-AU","","","","","","","","","","","","","","https://www.linkedin.com/company/ppl수도권약대생제약마케팅전략학회","","","","","","TRUE","","NAVER Cloud Corp.","","","Seongnam-si","GeoTrust RSA CA 2018","TLS 1.2","1667606399","TRUE","TRUE","TRUE","","","","","","PPL(수도권약대생제약마케팅전략학회)","NAVER Cloud Corp.","Pharmaceutical Manufacturing","","","51-200 employees","Nonprofit","","GO Jiyoung -- Student at seoulnationaluniversity"
"https://www.istockphoto.com","1.4.1 ; 1.4.14","526834","US ; SP","","EN ; ES ; FR ; ar ; az ; bg ; bn ; bs ; ca ; ch","","","","+18664786251","","","https://www.twitter.com/iStock","https://www.facebook.com/istock","https://www.instagram.com/istockbygettyimages","","","","","https://www.linkedin.com/company/istock-brasil-by-getty-images ; https://www.linkedin.com/company/aurospics ; https://www.linkedin.com/company/abrstockmarket ; https://www.linkedin.com/company/reinavanesa ; https://www.linkedin.com/company/izabela-habur-photography","","Stock Images, Royalty-Free Pictures, Illustrations & Videos - iStock","Explore millions of exclusive photographs, videos and illustrations that are researched and shot by a diverse global community to be inclusive and inspirational.","© 2022 iStockphoto LP. The iStock design is a trademark of iStockphoto LP. Browse millions of high-quality stock photos, illustrations, and videos.","2022","TRUE","WebSite ; SearchAction","","","","","Amazon","TLS 1.3","1671321599","TRUE","TRUE","TRUE","","","","","","iStock Brasil","ISTOCK PHOTO","Photography","Fundada em 2000, a iStock criou o segmento de acervo com crowd-sourcing e tornou-se a fonte original de fotografias, vetores e ilustrações, e vídeo clipes gerados pelos usuários. Por mais de 15 anos, temos dado aos nossos artistas uma plataforma para ganhar dinheiro com suas paixões, licenciando seu conteúdo para empresas e pessoas em todo o mundo, para uso em uma ampla variedade de projetos. Hoje, continuamos a ser líderes no setor e o principal destino para profissionais de criação que querem causar um grande impacto sem quebrar a banca. Nós acreditamos que as imagens têm o poder de mover o mundo. Acreditamos também que nossos clientes merecem o melhor conteúdo de acervo, e é por isso que temos orgulho de oferecer milhões de imagens de acervo exclusivas que podem ser obtidas apenas conosco. A iStock é parte da família de empresas da Getty Images.","São Paulo, SP ; São Paulo, SP, BR","51-200 employees","Privately Held","2000","Felipe Carmo -- Gestor de negócios e eficiência operacional ; Victor Lima -- Fotógrafo ; Rafa S Santos -- Designer na iStock Brasil ; ali olmaz -- Yardımcı - iStock Brasil"
"https://mxtoolbox.com","1.5.8","505391","","","","","","","","","","","","","","","","","https://www.linkedin.com/company/mxtoolbox ; https://www.linkedin.com/company/my-toolbox-inc","","","","","","","","","","","","","","","","","TRUE","","","","","","MxToolBox","","IT Services and IT Consulting","MxToolbox supports global Internet operations by providing free, fast and accurate network diagnostic and lookup tools. Millions of technology professionals use our tools to help diagnose and resolve a wide range of infrastructure issues. Innovation is why we come to work everyday. Almost all of our online tools started as internal projects we found useful and decided to share with the community. As the site has grown, we continue to invest heavily to develop new tools and services. Innovation is why we come to work everyday.","Austin, TX ; 12710 Research Blvd., Suite 225, Austin, TX 78759, US","11-50 employees","Privately Held","2003","Peter Leblond -- Product Development Engineer ; Steve Davies -- Head of Research and Development at MxToolBox ; John Barron -- Technical Support Professional at MxToolBox ; Austin Ewing -- Director of Product at MxToolBox"
"https://community.shopify.com","1.8.2","422861","US","WA","EN ; JA ; SR ; ar ; az ; bg ; ca ; cy ; da ; da-DK","","","","","","","https://www.twitter.com/shopify","https://www.facebook.com/shopify","https://www.instagram.com/shopify","","","","https://www.pinterest.com/shopify","https://www.linkedin.com/company/shopify","","","","","","TRUE","","Khoros, LLC","","","San Francisco","DigiCert TLS RSA SHA256 2020 CA1","TLS 1.3","1668211199","TRUE","TRUE","TRUE","UA-82702","","","","","","Khoros, LLC","","","","","","",""
"https://webflow.com","1.8.0","420658","US","","EN ; NL ; PT ; af ; ar ; ar-EG ; bn ; ca ; cs ; cy","privacy@webflow.com ; contact@webflow.com ; sponsorships@webflow.com ; events@webflow.com ; drew.coryer@webflow.com ; anthony.young-wiseman@webflow.com ; jenna.simmons@webflow.com ; support@webflow.com ; privacy@webflow.com ; ncc@webflow.com","sponsorships@webflow.com ; events@webflow.com ; drew.coryer@webflow.com ; anthony.young-wiseman@webflow.com ; jenna.simmons@webflow.com ; support@webflow.com ; privacy@webflow.com ; ncc@webflow.com ; Topher Chung <topher@webflow.com> ; Gregg Meluski -- Senior Software Engineer at Webflow <gregg.meluski@webflow.com>","sponsorships@webflow.com ; drew.coryer@webflow.com ; anthony.young-wiseman@webflow.com ; jenna.simmons@webflow.com ; ncc@webflow.com ; Topher Chung <topher@webflow.com> ; Gregg Meluski -- Senior Software Engineer at Webflow <gregg.meluski@webflow.com> ; Dave Gilbert <dave.gilbert@webflow.com> ; Dave Gilbert <dave@webflow.com>","","","","https://www.twitter.com/webflow","https://www.facebook.com/webflow","https://www.instagram.com/webflow","","https://www.tiktok.com/@webflow","https://www.youtube.com/webflow","","https://www.linkedin.com/company/webflow-inc- ; https://www.linkedin.com/company/deftuxdesign","","Webflow: Create a custom website | No-code website builder","Create professional, custom websites in a completely visual canvas with no code. Learn how to create a website by trying Webflow for free!","","","TRUE","Organization","","","","","Amazon","TLS 1.2","1665187199","TRUE","TRUE","TRUE","UA-1234567","","","","","Webflow","WEBFLOW","Computer Software","Webflow is the way to design, build, and launch powerful websites visually — without coding.","San Francisco, California ; 398 11th St, 2nd Floor, San Francisco, California 94103, US","201-500 employees","Privately Held","2012","Grímur Grímsson -- Video Producer at Webflow ; Dave Gilbert -- ; Topher Chung -- ; Eric Wittman -- ; Gregg Meluski -- Senior Software Engineer at Webflow"
"https://leetcode.com","","411905","","","","","","","","","","","","","","","","","https://www.linkedin.com/company/leet-code ; https://www.linkedin.com/company/mohd-yasir","","","","","","","","","","","","","","","","","TRUE","","","","","","LeetCode","","Information Technology and Services","Founded in the heart of Silicon Valley in 2015, LeetCode consists of an elite and entrepreneurial team with team members from the U.S., China, Canada, and India. We focused on the learning, growth, and career development of software engineers. Each day professional software engineers, students, and aspiring engineers use the rich resources of our platform to improve technical programming skills, get well-prepared for job interviews and land their dream jobs. By the end of 2017, we have achieved the milestone of more than one million of users. Here, there are countless success stories of landing dream jobs through LeetCode. In early October 2017, we have launched LeetCode China and set up a new office in Shanghai, China. Today, LeetCode is poised to take advantage of its rich resources and more localized content to cater to the huge Chinese developers' market. This together fulfill our vision of helping more people to learn, improve, and successfully land their jobs.","Palo Alto, CA ; Palo Alto, CA 94303, US ; Shanghai, Shanghai 200060, CN","11-50 employees","Privately Held","2015","Andy Gu -- Growth focused PM leader ; Daniel Coats -- Software Engineer ; Rob Taylor -- Software Engineer and Game Developer with hands-on experience ; Mandy Z. -- Chief Financial Officer at LeetCode"
"https://material.angular.io","","401991","","","","","","","","","","","","","","","","","","","","","","","","","","","","","","","","","","TRUE","","","","","","","","","","","","","",""
"https://material.io","1.6.2","380221","","","","","","","","","","","","","","","","","","","","","","","","","","","","","","","","","","FALSE","","","","","","","","","","","","","",""
"https://www.ovh.com","1.0.7 ; 1.5.11 ; 1.6.10 ; 1.7.9 ; 1.2.18 ; 1.0.8","370468","CA","QC","ES ; FR ; NL ; af ; ar ; ar-TN ; ca ; cy ; da ; de","","","","1-855-684-5463 ; +1 855 579 0059 ; +65 6962 8974 ; +61 383756 726 ; +420 228 888 017","","","","","","","","","","https://www.linkedin.com/company/pgr-concept","","","","© Copyright 1999-2022 OVHcloud","2022","TRUE","Corporation ; ImageObject ; SearchAction ; WebPage ; BreadcrumbList","","","","","Sectigo RSA Domain Validation Secure Server CA","TLS 1.3","1660867199","TRUE","TRUE","TRUE","","","","","","PGR Concept","OVHCLOUD","Business Consulting and Services","","","2-10 employees","Partnership","2010","Jean Philippe Raibaud -- Directeur Artistique chez PGR Concept ; David Bucio Nava -- jefe"
"https://my.sendinblue.com","1.2.26","353076","","","","","","","","","","","","","","","","","","","","","","","","","","","","","Cloudflare Inc ECC CA-3","TLS 1.3","1664409599","","","TRUE","","","","","","","","","","","","","",""
"https://manage.wix.com","1.2.28 ; 1.3.20 ; 1.5.11 ; 1.5.8","352343","US","CA ; VA","EN ; ZH-CN ; af-ES ; ar ; az ; bg-BG ; bn ; ca ; cy ; da","","","","","","","","","","","","","","","","","","","","TRUE","","","","","","Sectigo RSA Domain Validation Secure Server CA","TLS 1.3","1653609599","FALSE","FALSE","TRUE","","","","","","","USERS","","","","","","",""
"https://projects.invisionapp.com","1.2.22 ; 1.7.5","341774","US ; AR","","af ; ar ; bg ; bs ; ca ; cs ; cy ; da ; da-DK ; de","","","","","","","","","","","","","","https://www.linkedin.com/company/sml-salud-medica-laboral ; https://www.linkedin.com/company/athrazzi-technologies-inc ; https://www.linkedin.com/company/prettig ; https://www.linkedin.com/company/michael-design ; https://www.linkedin.com/company/spotworks-powered-by-x-cube-labs","","403 Forbidden","","","","FALSE","","","","","","COMODO ECC Domain Validation Secure Server CA 2","TLS 1.3","1602806399","FALSE","TRUE","TRUE","","","","","","SML Salud Medica Laboral","PROJECTS.INVISIONAPP","Hospitals and Health Care","Somos una empresa que brinda servicios de medicina laboral a compañías, pymes y comercios. Ubicados en el centro de Zárate, desde hace 10 años estamos al servicio de nuestros clientes para asistirlos con un tema tan delicado como importante: la salud de sus empleados. Contamos con personal altamente capacitado y actualizado que actúa de acuerdo a nuestros valores: la calidad médica, la responsabilidad y la satisfacción del cliente, todos contenidos dentro de una filosofía de trabajo ética.","Zárate, Buenos Aires ; San Martín 27 y 143,, Zárate, Buenos Aires, AR","11-50 employees","Privately Held","2007","Agustina Occello -- Responsable de facturación médica en SML Salud Medica Laboral ; Milagros Pasquale -- en ; cintia soledad mariño -- ; Maria Eugenia Choque Camacho -- Licenciatura en Enfermería en Universidad de Morón (Oficial)"
"https://platform.cloudways.com","1.4.8","341558","","","","","","","","","","","","","","","","","","","","","","","","","","","","","","","","","","TRUE","","","","","","","","","","","","","",""
"https://swiperjs.com","10 ; 2 ; 2216 ; 4 ; 456 ; 504 ; 507 ; 53 ; 7 ; 733","329245","US","VA ; NC ; NJ","EN-US ; ID ; NL ; RU ; ar ; ar-eg ; bg-BG ; bn ; cs ; cy","","","","","","","","","","","","","","","","Swiper - The Most Modern Mobile Touch Slider","Swiper is the most modern free mobile touch slider with hardware accelerated transitions and amazing native behavior.","","","TRUE","","","","","","R3","TLS 1.3","1645131624","FALSE","FALSE","TRUE","UA-149857145","","","","","","SWIPER","","","","","","",""
"https://orion.managewp.com","1.3.3 ; 1.5.11 ; 1.7.5","326708","","","","","","","","","","","","","","","","","","","","","","","","","","","","","","","","","","TRUE","","","","","","","","","","","","","",""
"https://accounts.spotify.com","1.8.0","313864","","","","","","","","","","","","","","","","","","","","","","","","","","","","","","","","","","TRUE","","","","","","","","","","","","","",""
"https://esale.ikco.ir","1.6.9","279631","","","","","","","","","","","","","","","","","","","","","","","","","","","","","","","","","","","","","","","","","","","","","","","",""
"https://www.roblox.com","1.6.3","274756","US","","ES ; ID ; NL ; RU ; SE ; ar ; ar-sa ; bg ; bn ; br","","","","","","","https://www.twitter.com/roblox","https://www.facebook.com/roblox","https://www.instagram.com/roblox","","","","","https://www.linkedin.com/company/147977","","","","©2022 Roblox Corporation. Roblox, the Roblox logo and Powering Imagination are among our registered and unregistered trademarks in the U.S. and other countries.","","TRUE","Organization","","","","","Go Daddy Secure Certificate Authority - G2","TLS 1.3","1660431214","TRUE","TRUE","TRUE","UA-486632","","","","","","ROBLOX","","","","","","",""
"https://www.paypal.com","1.5.8 ; 1.6.9","270178","US","","ar ; ar-EG ; ar-IQ ; ar-MA ; ar-SA ; bg ; bg-BG ; bn ; ca ; cs","ktyers@paypal.com ; fbelavenute@paypal.com ; pablo@paypal.com ; spoof@paypal.com","ktyers@paypal.com ; fbelavenute@paypal.com ; pablo@paypal.com ; spoof@paypal.com","","","","","","","","","","","","","","","","© 1999–2022","2022","TRUE","Organization","PayPal, Inc.","US","Delaware","San Jose","DigiCert SHA2 Extended Validation Server CA","TLS 1.3","1647388799","","","TRUE","","","","","","","PayPal, Inc.","","","","","","",""
"https://community.magento.com","1.8.2","259958","","","","","","","","","","","","","","","","","","","","","","","","","","","","","","","","","","TRUE","","","","","","","","","","","","","",""
"https://www.hostinger.com","1.5.1","255645","LT","","ar ; ar-AE ; ar-EG ; az ; bg ; bn ; bs-BA ; ca ; cy ; de","support@hostinger.com ; ayyoub@hostinger.com ; domains@hostinger.com ; gdpr@hostinger.com ; compliance@hostinger.com ; abuse@hostinger.com","ayyoub@hostinger.com ; domains@hostinger.com ; support@hostinger.com ; gdpr@hostinger.com ; compliance@hostinger.com ; abuse@hostinger.com","ayyoub@hostinger.com ; gdpr@hostinger.com","","","","https://www.twitter.com/Hostinger","https://www.facebook.com/Hostinger","https://www.instagram.com/hostinger_global","","","","","https://www.linkedin.com/company/hostinger-international","","Hosting Platform - Go Online With Hostinger For Only $1.39 Now","Choose your web hosting solution and make the perfect website! From shared hosting and domains to VPS - we have all you need for online success.","© 2004-2021 hostinger.com - Premium Web Hosting, Cloud, VPS & Domain Registration Services.","2004","TRUE","Service ; Brand ; AggregateOffer ; Organization ; PostalAddress","","","","","Sectigo RSA Domain Validation Secure Server CA","TLS 1.3","1638316799","TRUE","TRUE","TRUE","","","","","","Hostinger International","HOSTINGER","IT Services and IT Consulting","Hostinger is a customer-obsessed, idea-driven, ever-growing web hosting provider. As a global company, we believe in personal online expression and constant growth. With offices located in Lithuania, Indonesia, Brazil, Ukraine, and Cyprus we have an international team made of web hosting experts. They work hard daily to provide top-notch web hosting services and technology, allowing people around the globe to unlock the power of the internet and acquire the freedom to learn, create, and grow. We use no-limits PHP, MySQL, hPanel tools, allowing complete creative control over your personal endeavors. On top of that, we are the biggest free web hosting company in the world! We care deeply about the success of our clients, understanding the scale of our work and its daily global impact. Hostinger works diligently every day, to lay the path for your success. We are constantly striving to find faster and easier to use web hosting solutions at the price nobody can beat. Customer is our top priority. With a team made of real web hosting professionals, we provide top-notch web hosting services with an extreme emphasis on Customer Success. Hostinger Company Vision At Hostinger our vision is to enable millions of people around the globe to unlock the power of Internet by giving them tools to learn, create and grow online. Hostinger Company Mission Our mission is to make life easier for website developers and their customers. Our company idea supports this mission by offering stable, fast and simple website hosting solutions, at a price so low that nobody can beat. https://www.slideshare.net/Hostinger/hostinger-company-culture-78915467","Kaunas, Kaunas ; Jonavos g. 60c, Kaunas, Kaunas 44192, LT","501-1,000 employees","Privately Held","2004","Linas Konovalovas -- Chief Risk Officer at Hostinger International ; Thomas Strohe -- Serial Entrepreneur und Investor ; Domantas Berzanskis -- ; Andrius Putna -- Hostinger, Doer"
"https://jasonwatmore.com","1.5.7 ; 1.5.11","245439","","","","","","","","","","","","","","","","","","","","","","","","","","","","","","","","","","FALSE","","","","","","","","","","","","","",""
"https://appstoreconnect.apple.com","1.2.32 ; 1.5.8 ; 1.8.2","241577","","","","","","","","","","","","","","","","","","","","","","","","","","","","","","","","","","TRUE","","","","","","","","","","","","","",""
"https://www.hostinger.in","1.5.1","232082","","","","","","","","","","","","","","","","","","","","","","","","","","","","","","","","","","TRUE","","","","","","","","","","","","","",""
"https://insights.hotjar.com","1.6.10","226658","","","","","","","","","","","","","","","","","","","","","","","","","","","","","","","","","","TRUE","","","","","","","","","","","","","",""
"https://dcc.godaddy.com","1.5.10","225434","","","","","","","","","","","","","","","","","","","","","","","","","","","","","","","","","","TRUE","","","","","","","","","","","","","",""
