"URL","Versions","Traffic rank","IP country","IP region","Language","Email address","Email address (verified)","Email address (safe)","Phone number","Skype","WhatsApp","Twitter","Facebook","Instagram","GitHub","TikTok","YouTube","Pinterest","LinkedIn","Owler","Title","Description","Copyright","Copyright year","Responsive","schema.org types","Cert organisation","Cert country","Cert state","Cert locality","Cert issuer","Cert protocol","Cert expiry","SPF record","DMARC record","SSL/TLS enabled","Google Analytics","Google AdSense","Medianet","Facebook","Optimizely","Company name","Inferred company name","Industry","About","Locations","Company size","Company type","Company founded","People"
"https://noticias.uol.com.br","1.4.5","64702","","","","","","","","","","","","","","","","","","","","","","","","","","","","","","","","","","TRUE","","","","","","","","","","","","","",""
"https://app.pandadoc.com","1.5.0","64592","US","","NL ; bg ; ca ; cy ; da ; da-DK ; de ; de-CH ; de-DE ; de-de","","","","","","","","","","","","","","","","","","","","TRUE","","","","","","GlobalSign Atlas R3 DV TLS CA H2 2021","TLS 1.3","1647150620","TRUE","TRUE","TRUE","","","","","","","APP.PANDADOC","","","","","","",""
"https://web.microsoftstream.com","1.5.3","64370","","","","","","","","","","","","","","","","","","","","","","","","","","","","","","","","","","TRUE","","","","","","","","","","","","","",""
"https://www.poste.it","1.5.0 ; 1.5.5 ; 1.6.10 ; 1.6.5","64096","IT","","bg ; ca ; de ; de-DE ; en ; en-GB ; en-US ; en-us ; es ; fa","","","","","","","https://www.twitter.com/postenews","https://www.facebook.com/PosteItaliane","https://www.instagram.com/posteitaliane","","","","","https://www.linkedin.com/company/crova-spa","","Poste Italiane - Servizi postali, finanziari e assicurativi","Poste Italiane vi presenta l´offerta di prodotti e servizi postali, finanziari e assicurativi, disponibili online e negli uffici postali presenti in tutta Italia.","© Poste Italiane 2021 - Partita iva: 01114601006","2021","TRUE","","POSTE ITALIANE S.p.A.","IT","","ROMA","GlobalSign Extended Validation CA - SHA256 - G3","TLS 1.2","1648463412","","","TRUE","","","","","","Crova SpA","POSTE ITALIANE S.p.A.","Retail Apparel and Fashion","Crova SpA is an apparel & fashion company based out of Valenza, Piedmont, Italy.","Valenza, Piedmont ; Valenza, Piedmont 15048, IT","2-10 employees","","",""
"https://youtrack.jetbrains.com","1.6.10","63312","","","","","","","","","","","","","","","","","","","","","","","FALSE","","","","","","R3","TLS 1.2","1639869310","TRUE","TRUE","TRUE","","","","","","","CHROMEWEBDATA","","","","","","",""
"https://app.activecollab.com","1.6.4","63223","","","","","","","","","","","","","","","","","","","","","","","","","","","","","","","","","","TRUE","","","","","","","","","","","","","",""
"https://about.google","1.6.6","62785","US","CA","ar ; bg-BG ; bn ; ca ; cy ; da ; de ; de-AT ; de-DE ; de-de","press@google.com","","","+1-650-253-0000","","","https://www.twitter.com/google","https://www.facebook.com/Google","https://www.instagram.com/google","","","https://www.youtube.com/musicpremium","","https://www.linkedin.com/company/google","","Google - About Google, Our Culture & Company News","Stay up to date with Google company news and products. Discover stories about our culture, philosophy, and how Google technology is impacting others.","","","TRUE","","","","","","GTS CA 1C3","TLS 1.3","1646260820","FALSE","FALSE","TRUE","","","","","","","GOOGLE","","","","","","",""
"https://sg-files.hostinger.in","1.5.11","61420","IN","","ar ; ca ; cy ; da ; de ; en ; en-GB ; en-IE ; en-IN ; en-US","","","","","","","","","","","","","","","","Hostinger File Manager","","","","TRUE","","","","","","Sectigo RSA Domain Validation Secure Server CA","TLS 1.2","1648252799","TRUE","TRUE","TRUE","","","","","","","HOSTINGER","","","","","","",""
"https://app-smtp.sendinblue.com","1.3.0","61400","US","","ca ; cb ; co ; cy ; da-DK ; de ; de-DE ; de-de ; en ; en-AU","","","","","","","","","","","","","","","","","","","","TRUE","","","","","","Cloudflare Inc ECC CA-3","TLS 1.3","1664409599","TRUE","TRUE","TRUE","","","","","","","APP.SENDINBLUE","","","","","","",""
"https://filemanager.ai","1.7.4","61052","","","","","","","","","","","","","","","","","","","","","","","","","","","","","","","","","","FALSE","","","","","","","","","","","","","",""
"https://community.powerbi.com","1.7.4 ; 1.8.2","61051","","","","","","","","","","","","","","","","","https://www.linkedin.com/company/milwaukee-brew-city-pug ; https://www.linkedin.com/company/so-cal-power-bi","","","","","","","","","","","","","","","","","TRUE","","","","","","Milwaukee Brew City - Power Platform","","Information Technology and Services","NOTE: We are renaming from Power BI to Power Platform as we will be adding content from Power BI, Power Apps, Power Automate and Virtual Agents. Serving the Milwaukee area in Wisconsin, United States. Our objective is to provide a forum for Wisconsin professionals of all levels to network, ask questions, and share knowledge and expertise with other members about Power BI and applicable areas. This user group is community lead, meaning that all topics and PUG activities are chosen by the members attending. This group meets on the last Tuesday of each month, with some exceptions for holidays. Check out our calendar and we would love to see you at our next PUG meeting.","Milwaukee, Wisconsin ; 833 E Michigan St, Milwaukee, Wisconsin 53202, US","","Public Company","2015",""
"https://getsupport.apple.com","1.3.20","60576","","","","","","","","","","","","","","","","","","","","","","","","","","","","","","","","","","TRUE","","","","","","","","","","","","","",""
"https://us.etrade.com","1.4.0 ; 1.6.3 ; 1.2.16","60571","US","","EN-US ; KO ; ca ; cs ; cy ; da ; de ; de-DE ; en ; en-AU","","","","18003872331 ; 18008380908 ; 18554326834 ; 1-866-650-0003 ; +1-678-624-6950","","","https://www.twitter.com/etrade","https://www.facebook.com/ETRADE","https://www.instagram.com/etrade_financial","","","","","https://www.linkedin.com/company/etrade ; https://www.linkedin.com/company/etrade-advisor-services ; https://www.linkedin.com/company/etrade-bank-inc ; https://www.linkedin.com/company/e-trade-mortgage-corporation ; https://www.linkedin.com/company/e-trade-atm","","","","","","TRUE","","E*TRADE Financial Holdings, LLC","US","Delaware","New York","COMODO RSA Extended Validation Secure Server CA","TLS 1.2","1655423999","TRUE","TRUE","TRUE","","","","","","E*TRADE Advisor Services","E*TRADE Financial Holdings, LLC","Financial Services","E*TRADE Advisor Services is a provider of integrated technology, custody, and practice management support for registered investment advisors (RIAs). E*TRADE Advisor Services is dedicated to helping RIAs realize their full potential and provide them the support they need to manage their practices and clients’ financial futures.","Centennial, Colorado ; 7103 South Revere Parkway, Centennial, Colorado 80112, US","51-200 employees","Public Company","","Lindsay Faussone -- ; Erin Heft -- Relationship Manager II at Trust Company of America"
"https://www.borna.news","1.7.9","59608","","","","","","","","","","","","","","","","","","","","","","","","","","","","","","","","","","TRUE","","","","","","","","","","","","","",""
"https://services.gst.gov.in","1.5.6","59410","","","","","","","","","","","","","","","","","","","","","","","","","Goods And Services Tax Network","IN","","New Delhi","Entrust Certification Authority - L1M","TLS 1.2","1667124774","TRUE","TRUE","TRUE","","","","","","","","","","","","","",""
"https://docs.rackspace.com","1.8.2","58497","","","","","","","","","","","","","","","","","","","","","","","","","","","","","","","","","","TRUE","","","","","","","","","","","","","",""
"https://www.datacamp.com","1.4.14","58326","","","","","","","","","","","","","","","","","https://www.linkedin.com/company/datacampinc ; https://www.linkedin.com/company/data-science-in-python","","","","","","","","","","","","","","","","","TRUE","","","","","","DataCamp","","E-Learning","Give your teams the 21st-century skills they need to work with data in the real world. DataCamp is the leading online platform designed to teach modern professionals the data skills they need at their own pace. From non-coding essentials to data science and machine learning, all taught by leading experts in the field. DataCamp Enterprise gives you the power to upskill everyone on your team to make better data-driven decisions—faster. Join more than 1,200 companies learning on DataCamp today.  We’re hiring! Join the DataCamp team: datacamp.com/jobs","New York, NY ; 350 5th Avenue, 77th fl, New York, NY 10118, US ; Martelarenlaan 38, Leuven, Flemish Brabant 3010, BE","51-200 employees","Privately Held","2014","Marcin G. -- ; Gill Van de Water -- IT Manager @ Datacamp ; Mina Badawi -- Customer Success Manager at DataCamp ; Sumit Kumar --"
"https://www.wantedly.com","1 ; 1.2.28","58196","","","","people-support@wantedly.com ; customer-relations@wantedly.com","people-support@wantedly.com ; customer-relations@wantedly.com","people-support@wantedly.com ; customer-relations@wantedly.com","","","","","","","","","","","https://www.linkedin.com/company/wantedly ; https://www.linkedin.com/company/bespo-inc ; https://www.linkedin.com/company/wantedlyhk","","","","","","","","","","","","","","","","","TRUE","","","","","","Wantedly Inc.","","Staffing and Recruiting","Founded in late 2010, Wantedly is a Tokyo based startup that enables companies and talent to discover, connect and engage with each other. We match passionate and driven talent with inspiring companies and help people strengthen and build upon their network. We spend up to 1/3 of our lives working, so let's spend that time on something we believe in. We are hiring! So come and join us as we create a world where work drives passion!","港区白金台, 東京都 ; 5-12-7 MG白金台ビル 4F, 港区白金台, 東京都 108-0071, JP","51-200 employees","Public Company","2011","Akitsugu Otani -- HR Manager - Wantedly, inc. (We're hiring!) ; Mizuki Iwaya -- Wantedly,Inc ; Yoshinori Kawasaki -- Software Engineer, CTO at Wantedly, Inc. (We're hiring!) ; 永島次朗 -- エンジニア - Wantedly,inc."
"https://www.bountysource.com","1.2.16","57753","","","","","","","","","","","","","","","","","https://www.linkedin.com/company/bountysource","","","","","","","","","","","","","","","","","TRUE","","","","","","Bountysource","","Software Development","Bountysource is the funding platform for open-source software. Users can improve the open-source projects they love by creating/collecting bounties and pledging to fundraisers. 'Bounties' are funded by users that want to see particular open issues or feature requests addressed. These users spread the word about the bounty, enticing developers to create a solution. Developers create solutions and submit them on Bountysource. Bountysource tracks these solutions, sees which one gets accepted by the open-source project, and then pays the bounty to the developer. 'Fundraisers' can be created by anyone. Open-source fundraisers are typically used to raise money for new projects, big updates to existing projects, or to raise money for bounties. The Fundraiser creator spreads the word about the Fundraiser to their communities. Anyone can make a pledge to a Fundraiser, helping it reach its funding goal in time.","San Francisco ; Bay Area, San Francisco, US","2-10 employees","Privately Held","2004","Nicolas Le Herissier -- Managing Director chez Bountysource @theblockchaingroup ; Soheil Sk -- Co-Founder & Chief Strategy Officer @The Blockchain Group | Chief Operating Officer @BountySource 🍄 We’re hiring! ; Rafael de Lucena Valle -- Software Engineer ; Ilan Mourlevat -- Chargé de Marketing Digital chez Bountysource"
"https://blog.google","1.6.4","57321","","","","","","","","","","","","","","","","","","","","","","","","","","","","","","","","","","FALSE","","","","","","","","","","","","","",""
"https://flippa.com","1.2.32","56339","AU","","EN ; ar ; bg ; bs ; ca ; cy ; de ; en ; en-AE ; en-AU","Blake Hutchison -- #1 Marketplace to Buy & Sell Digital Real Estate - Sites, Stores, Apps and Online Businesses <blake.hutchison@flippa.com> ; Blake Hutchison -- #1 Marketplace to Buy & Sell Digital Real Estate - Sites, Stores, Apps and Online Businesses <blake@flippa.com> ; Amber Burke -- Business Development / Digital Asset Specialist <amber.burke@flippa.com>","Blake Hutchison -- #1 Marketplace to Buy & Sell Digital Real Estate - Sites, Stores, Apps and Online Businesses <blake.hutchison@flippa.com> ; Blake Hutchison -- #1 Marketplace to Buy & Sell Digital Real Estate - Sites, Stores, Apps and Online Businesses <blake@flippa.com> ; Amber Burke -- Business Development / Digital Asset Specialist <amber.burke@flippa.com>","Blake Hutchison -- #1 Marketplace to Buy & Sell Digital Real Estate - Sites, Stores, Apps and Online Businesses <blake.hutchison@flippa.com> ; Blake Hutchison -- #1 Marketplace to Buy & Sell Digital Real Estate - Sites, Stores, Apps and Online Businesses <blake@flippa.com> ; Amber Burke -- Business Development / Digital Asset Specialist <amber.burke@flippa.com>","","","","https://www.twitter.com/flippa","https://www.facebook.com/flippamarketplace","https://www.instagram.com/flippamarketplace","","","","","https://www.linkedin.com/company/flippa ; https://www.linkedin.com/company/fireflies---putuj-i-zaradi","","Buy and Sell Online Businesses, Websites, Apps & Domains - Flippa","Buy & Sell Online Businesses on the Flippa marketplace.","© 2022 Flippa.com Pty Ltd. All rights reserved.","2022","TRUE","","","","","","Cloudflare Inc ECC CA-3","TLS 1.3","1657324799","","","TRUE","","","","","","Flippa.com","FLIPPA MARKETPLACE","Internet","Founded in 2009, Flippa exists to support the small business ecosystem so that any business owner or buyer can sell or acquire a business. Flippa is the leading platform and network connecting online business owners with buyers all over the world. Flippa leverages more than 120,000 buyers representing $1.2bn in purchasing intent. Each month, over $41m worth of business value is listed for sale on Flippa and nearly 500,000 business owners and buyers visit Flippa to sell or buy businesses between the prices of $5,000 and $5,000,000. Owners of eCommerce, SaaS, Marketplace, Fulfilled by Amazon, Content, Advertising and other online businesses choose Flippa because it’s the easiest place to list and showcase, best place to connect and negotiate and the safest place to transact. Co-Founded by the Founders of 99Designs and SitePoint, Flippa aims to help small business owners find their exit, in an easy to use and safe environment.","Fitzroy, Victoria ; 110 Johnston St, Fitzroy, Victoria 3065, AU","11-50 employees","Privately Held","2009","Blake Hutchison -- #1 Marketplace to Buy & Sell Digital Real Estate - Sites, Stores, Apps and Online Businesses ; Rodolfo C. Burla de Aguiar -- Senior Software Engineer at Flippa ; Amber Burke -- Business Development / Digital Asset Specialist ; Rebecca O’Connell -- Head of People & Culture, Flippa.com"
"https://ionicframework.com","1.2.18 ; 1.6.8","56125","US","","ar ; bg ; cy ; de-DE ; en ; en-CA ; en-GB ; en-IN ; en-US ; en-us","devrel@ionic.io","","","","","","https://www.twitter.com/Ionicframework ; https://www.twitter.com/IonicFramework ; https://www.twitter.com/ionicframework","https://www.facebook.com/ionicframework","https://www.instagram.com/ionicframework","","","","","https://www.linkedin.com/company/drifty-co-","","Cross-Platform Mobile App Development: Ionic Framework","Ionic Framework's app development platform builds amazing cross-platform mobile, web, and desktop apps all with one shared code base and open-web standards.","©2020 Ionic","2020","TRUE","Organization","","","","","Cloudflare Inc ECC CA-3","TLS 1.3","1654041599","TRUE","TRUE","TRUE","UA-44023830","","","","","","IONIC FRAMEWORK","","","","","","",""
"https://www.intesasanpaolo.com","1.4.7 ; 1.6.3","55132","IT","","IT ; ca ; ch-DE ; cy ; de ; en ; en-GB ; en-IT ; en-US ; en-gb","dpo@intesasanpaolo.com ; info@intesasanpaolo.com ; artific_intellig_lab.58036@intesasanpaolo.com ; dpo@intesasanpaolo.com ; Guido Bolognesi -- IT Security <guido.bolognesi@intesasanpaolo.com> ; Andrea Musu <andrea.musu@intesasanpaolo.com>","info@intesasanpaolo.com ; artific_intellig_lab.58036@intesasanpaolo.com ; dpo@intesasanpaolo.com ; Guido Bolognesi -- IT Security <guido.bolognesi@intesasanpaolo.com> ; Andrea Musu <andrea.musu@intesasanpaolo.com>","artific_intellig_lab.58036@intesasanpaolo.com ; dpo@intesasanpaolo.com ; Guido Bolognesi -- IT Security <guido.bolognesi@intesasanpaolo.com> ; Andrea Musu <andrea.musu@intesasanpaolo.com>","+39 011 8019.200 ; +39 0287109001","","","https://www.twitter.com/IntesaSP_Help","https://www.facebook.com/IntesaSanpaolo","","","","","","https://www.linkedin.com/company/164437 ; https://www.linkedin.com/company/freelance-at-banca-intesa-sanpaolo-at-coworker-tecnocube-s.r.l. ; https://www.linkedin.com/company/cassa-di-risparmio-delle-provincie-lombarde-cariplo-","","Banca Intesa Sanpaolo - Conto Corrente per Famiglie, Giovani e Aziende","Visita il sito Intesasanpaolo.com e scopri la tua nuova banca online: un mondo di vantaggi e servizi che renderanno la tua vita più semplice. Conto Corrente per Famiglie, Giovani e Aziende.","","","TRUE","Corporation ; ContactPoint ; PostalAddress ; FAQPage ; Question","INTESA SANPAOLO SPA","IT","","Torino","GlobalSign Extended Validation CA - SHA256 - G3","TLS 1.2","1648388373","TRUE","TRUE","TRUE","","","","","","Head of Data Technology Office at Intesa Sanpaolo","INTESA SANPAOLO SPA","Banking","Intesa Sanpaolo è il gruppo bancario nato dalla fusione di Banca Intesa e Sanpaolo IMI, due grandi realtà bancarie italiane caratterizzate da valori comuni che si sono aggregate per crescere, per servire meglio le famiglie e per contribuire ulteriormente allo sviluppo delle imprese e alla crescita del paese. Intesa Sanpaolo si colloca tra i primissimi gruppi bancari dell'eurozona con una capitalizzazione di mercato di 36,8 miliardi di euro(1). Intesa Sanpaolo è leader in Italia in tutti i settori di attività (retail, corporate e wealth management). Il Gruppo offre i propri servizi a 11,1 milioni di clienti avvalendosi di una rete di circa 4.000 sportelli presenti su tutto il territorio nazionale con quote di mercato non inferiori al 12% nella maggior parte delle regioni. Intesa Sanpaolo ha una presenza selettiva in Europa centro-orientale e nel Medio Oriente e Nord Africa, grazie a circa 1.200 sportelli e 7,8 milioni di clienti delle banche controllate operanti nel commercial banking in 12 Paesi. Vanta inoltre una rete internazionale specializzata nel supporto alla clientela corporate, che presidia 29 Paesi, in particolare il Medio Oriente e Nord Africa e le aree in cui si registra il maggior dinamismo delle imprese italiane, come Stati Uniti, Brasile, Russia, India e Cina.","","2-10 employees","Public Company","","Simonetti Mauro -- Informatico presso Freelance at Banca Intesa SanPaolo at coworker TecnoCube S.r.l. ; Montalbano Monica -- ragioniera/ personal trainer presso Freelance at Banca Intesa SanPaolo at coworker TecnoCube S.r.l. ; Maurizio Grifalconi -- p.E. presso Freelance at Banca Intesa SanPaolo at coworker Engineering M:O ; germana d'alessandro -- Comunicatore d'impresa, giornalista"
"https://www.manoramaonline.com","1.6.5","55096","IN ; NL","","de ; en ; en-AE ; en-GB ; en-IN ; en-US ; en-ae ; en-au ; en-in ; en-us","","","","","","","https://www.twitter.com/manoramaonline","https://www.facebook.com/manoramaonline","https://www.instagram.com/manoramaonline","","","","","https://www.linkedin.com/company/manoramaonline ; https://www.linkedin.com/company/malayala-manorama","","Manorama Online : Breaking News | Latest Malayalam News | Malayala Manorama News Paper | Kerala | India | Politics | Sports | Movie | Lifestyle | E Paper | Kerala News | Manorama News","Latest Malayalam News from Manorama Online. Breaking News Kerala India. Politics News Events. Sports News. Movie News. Lifestyle News. E Paper..Malayalam News. Breaking News. Kerala News. Malayala Manorama. Manorama Online. Kerala Election Results","© Copyright 2021 Manoramaonline. All rights reserved.","2021","TRUE","NewsMediaOrganization ; PostalAddress ; ContactPoint","","","","","DigiCert SHA2 Secure Server CA","TLS 1.3","1665273599","","","TRUE","UA-142486390","","","","","Manorama Online","MANORAMA ONLINE","Online Media","Manorama Online, the digital vertical of Malayala Manorama, brings you timely updates on news, events and current affairs from Kerala and across the globe in Malayalam.","Kottayam, Kerala ; Malayala Manorama Buildings, KK Road, Kottayam, Kerala 686001, IN","501-1,000 employees","Privately Held","1888","Amin Seethy -- Product Manager | Digital Products ; Sachin Wadikar -- Regional Manager - West at Malayala Manorama ; Arun Rahim -- Deputy General Manager at Manorama Online ; Subin Shankar -- Digital Ad Consultant at Manorama Online"
"https://community.cisco.com","1.8.2 ; 1.4.8","54885","US","","ar ; ca ; cs ; da ; de ; de-DE ; de-de ; el ; el-GR ; en","","","","","","","https://www.twitter.com/cisco_support","https://www.facebook.com/CiscoSupportCommunity","https://www.instagram.com/ciscosupportcommunity","","","","","https://www.linkedin.com/company/cisco-support-community","","Home - Cisco Community","","Copyright © 2022 Cisco Systems Inc.","2022","TRUE","","Khoros, LLC","","","San Francisco","DigiCert TLS RSA SHA256 2020 CA1","TLS 1.3","1674259199","TRUE","TRUE","TRUE","","","","","","","Khoros, LLC","","","","","","",""
"https://survey.porsline.ir","1.5.8","54829","","","","","","","","","","","","","","","","","https://www.linkedin.com/company/bilche-app","","","","","","FALSE","","","","","","R3","TLS 1.3","1650487460","TRUE","TRUE","TRUE","","","","","","Bilche | بیلچه","CHROMEWEBDATA","Health, Wellness and Fitness","Coming Soon...","Tehran, Tehran ; Tehran, Tehran, IR","2-10 employees","Self-Employed","",""
"https://squarecc-us-prod-v1.awsapps.com","1.2.16 ; 1.8.0 ; 1.8.1","54793","","","","","","","","","","","","","","","","","","","","","","","","","","","","","","","","","","TRUE","","","","","","","","","","","","","",""
"https://poczta.wp.pl","1.5.8","54593","","","","","","","","","","","","","","","","","","","","","","","","","","","","","","","","","","TRUE","","","","","","","","","","","","","",""
"https://login.sendpulse.com","1.8.2 ; 1.6.10","54571","US","","ca ; cy ; da ; en ; en-GB ; en-US ; en-gb ; en-us ; es ; es-ES","","","","","","","","","","","","","","","","","","","","TRUE","","","","","","Sectigo RSA Domain Validation Secure Server CA","TLS 1.2","1667087999","TRUE","TRUE","TRUE","","","","304832899913845","","","LOGIN.SENDPULSE","","","","","","",""
"https://www.000webhost.com","1.5.9","54451","CY","","EN ; am ; ar-DZ ; az ; ca ; cn ; cy ; en ; en-BD ; en-GB","","","","","","","","","","","","","","https://www.linkedin.com/company/000webhost","","Just a moment...","","","","FALSE","","","","","","Sectigo RSA Domain Validation Secure Server CA","TLS 1.3","1642204799","","","TRUE","","","","","","000webhost","000WEBHOST","IT Services and IT Consulting","Our passion is to power up internet society and provide absolutely free, easy & very useful website management & free web hosting services all around the world. Our team has grown drastically since 2004 and become top class web hosting industry leaders among free hosting providers all over the net. 000webhost.com's daily task is to serve millions of free hosting users and customers with hundreds of servers around. We listen to & hear our customers needs and manage on the basis of latest technologies.","Larnaca ; 61 Lordou Vironos Street, Larnaca, CY ; Jonavos g. 60C, 44192, Kaunas, LT","201-500 employees","Privately Held","2007","Christopher Al Khawand -- Student, Future Engineer, Tech Savvy ; Owen Sullivan -- Remote IT Administrator at Intellectus, volunteer at 000webhost.com/Hostinger International; trained SysAdmin, amateur web designer/developer. Honors…"
"https://www.eghtesadnews.com","1.8.2","54232","","","","","","","","","","","","","","","","","","","","","","","","","","","","","","","","","","TRUE","","","","","","","","","","","","","",""
"https://files.000webhost.com","1.5.11","54161","","","","","","","","","","","","","","","","","","","","","","","","","","","","","","","","","","TRUE","","","","","","","","","","","","","",""
"https://kahoot.it","","53898","IT","","ES ; ES-ES ; HR ; ID ; SE ; ar ; bn ; ca ; cs ; cy","","","","","","","","","","","","","","","","Play Kahoot! - Enter game PIN here!","Join a game of kahoot here. Kahoot! is a free game-based learning platform that makes it fun to learn – any subject, in any language, on any device, for all ages!","","","TRUE","","","","","","Sectigo RSA Domain Validation Secure Server CA","TLS 1.2","1645747199","TRUE","TRUE","TRUE","","","","","","","KAHOOT","","","","","","",""
"https://boardgamegeek.com","1.7.5 ; 1.3.13","53768","","","","","","","","","","","","","","","","","https://www.linkedin.com/company/boardgamegeek ; https://www.linkedin.com/company/boardgamegeek-llc ; https://www.linkedin.com/company/jogosalmirante","","","","","","","","","","","","","","","","","TRUE","","","","","","BoardGameGeek","","Internet","","Dallas, Texas ; 7930 Xavier Ct, Dallas, Texas 75218, US","2-10 employees","Privately Held","2000","Scott Alden -- ; W. Eric Martin -- ; Beth Heile -- Product Manager at BoardGameGeek ; Chad Krizan -- Advertising Manager at BoardGameGeek, LLC"
