"URL","Versions","Traffic rank","IP country","IP region","Language","Email address","Email address (verified)","Email address (safe)","Phone number","Skype","WhatsApp","Twitter","Facebook","Instagram","GitHub","TikTok","YouTube","Pinterest","LinkedIn","Owler","Title","Description","Copyright","Copyright year","Responsive","schema.org types","Cert organisation","Cert country","Cert state","Cert locality","Cert issuer","Cert protocol","Cert expiry","SPF record","DMARC record","SSL/TLS enabled","Google Analytics","Google AdSense","Medianet","Facebook","Optimizely","Company name","Inferred company name","Industry","About","Locations","Company size","Company type","Company founded","People"
"https://web.whatsapp.com","16.14.0","8168731","","","","","","","","","","","","","","","","","https://www.linkedin.com/company/achieve-languages-jacareí ; https://www.linkedin.com/company/marsonrepresentacoes ; https://www.linkedin.com/company/agile-dedetizadora ; https://www.linkedin.com/company/doradoaso ; https://www.linkedin.com/company/grupoprimeb2b ; https://www.linkedin.com/company/mexicanamultimodal","","","","","","","","","","","","","","","","","FALSE","","","","","","Achieve Languages Jacareí","","Education Management","Somos uma rede de escolas de idiomas de abrangência nacional, que atua com base em valores educacionais sólidos, que alia o que há de mais atual em termos de ensino de línguas com a tradição e a confiabilidade alcançadas ao longo de vários séculos dedicados a estudos, pesquisas e desenvolvimento na área educacional por parte da Oxford University Press e da University of Oxford. O respaldo dessas instituições nos habilita a desenvolver um trabalho de alta qualidade e que proporciona todas as condições para que os alunos aprendam a se comunicar no idioma estudado.","Jacarei, AC","2-10 employees","Educational Institution","2005","fabiana torati -- Proprietário da empresa na Achieve Languages by Oxford"
"https://medium.com","16.10.2","2186236","","","EN ; EN-US ; ES ; ES-XM ; FR ; ID ; IT ; KO ; LV ; NL","yourfriends@medium.com","yourfriends@medium.com","yourfriends@medium.com","","","","","","","","","","","","","Medium – Where good ideas find you.","Medium is an open platform where readers find dynamic thinking, and where expert and undiscovered voices can share their writing on any topic.","","","FALSE","Organization ; ImageObject","","","","","Cloudflare Inc ECC CA-3","TLS 1.3","1648511999","","","TRUE","UA-24232453","","","","","","MEDIUM","","","","","","",""
"https://www.fiverr.com","15.7.0 ; 16.14.0","1951216","US","","EN ; EN-US ; ES ; FR ; JA ; NL ; PL ; TR ; ar ; ar-AE","privacy@fiverr.com ; workspace-support@fiverr.com ; optout@fiverr.com ; evyatar.a@fiverr.com ; workspace-support@fiverr.com ; info@fiverr.com ; optout@fiverr.com ; privacy@fiverr.com ; support@fiverr.com","evyatar.a@fiverr.com ; workspace-support@fiverr.com ; info@fiverr.com ; optout@fiverr.com ; privacy@fiverr.com ; support@fiverr.com","","","","","https://www.twitter.com/fiverr","https://www.facebook.com/fiverr","https://www.instagram.com/fiverr","","","","https://www.pinterest.com/fiverr","https://www.linkedin.com/company/fiverr-com","","Fiverr - Freelance Services Marketplace for Businesses","Fiverr's mission is to change how the world works together. Fiverr connects businesses with freelancers offering digital services in 500+ categories.","","","TRUE","Organization ; WebSite ; BreadcrumbList ; ListItem ; FAQPage","","","","","Cloudflare Inc ECC CA-3","TLS 1.2","1672271999","TRUE","TRUE","TRUE","","","","","","","FIVERR","","","","","","",""
"https://coinmarketcap.com","","1695687","DE","","EN ; ES ; FA ; FR ; Fa-IR ; IT ; NL ; PL-pl ; PT ; RU","legal@coinmarketcap.com","legal@coinmarketcap.com","","","","","https://www.twitter.com/coinmarketcap ; https://www.twitter.com/CoinMarketCap","https://www.facebook.com/CoinMarketCap","https://www.instagram.com/coinmarketcap","","","","","https://www.linkedin.com/company/coinmarketcap ; https://www.linkedin.com/company/cryptocurrency-ico-airdrop ; https://www.linkedin.com/company/vastech-ileti-im-teknolojileri-san-ve-tic-ltd-ti- ; https://www.linkedin.com/company/happybirthdaycoin","","Cryptocurrency Prices, Charts And Market Capitalizations | CoinMarketCap","Top cryptocurrency prices and charts, listed by market capitalization. Free access to current and historic data for Bitcoin and thousands of altcoins.","","","TRUE","Organization ; Table","","","","","Amazon","TLS 1.3","1667519999","","","TRUE","","","","","","CoinMarketCap","COINMARKETCAP","Information Services","CoinMarketCap is the world's most trusted & accurate source for crypto market capitalizations, pricing and information. CoinMarketCap is a U.S. company registered in the United States of America. CoinMarketCap has been the premier price-tracking website for cryptocurrencies. It is the most referenced and trusted source for comparing thousands of crypto entities in the rapidly growing cryptocurrency space by users, institutions, and media. CoinMarketCap firmly stands for accurate, timely and unbiased information, enabling each end user to draw their own informed conclusions from CoinMarketCap data.","Delaware, DE ; Delaware, DE 19901, US","11-50 employees","Privately Held","","Stuart Langridge -- Head of SEO at CoinMarketCap ; Misty .K. -- Entrepreneurial business and finance professional with experience across a broad range of functions and industries Business Owner at… ; Gloria Tellez -- Empresária | Consultora | Autora | Palestrante ; Tien-Chih (Tenz) Shih -- Editor In Chief at HannStar Display"
"https://www.figma.com","","1586766","US","","DE ; EN ; ES ; En ; FR ; HU ; ID ; KO ; NL ; PL","press@figma.com ; Sho Kuwamoto -- Director of Product <sho@figma.com> ; support@figma.com ; copyright@figma.com ; privacyshield@figma.com ; jonas@figma.com","press@figma.com ; Sho Kuwamoto -- Director of Product <sho@figma.com> ; support@figma.com ; copyright@figma.com ; privacyshield@figma.com ; jonas@figma.com","Sho Kuwamoto -- Director of Product <sho@figma.com> ; privacyshield@figma.com ; jonas@figma.com","","","","https://www.twitter.com/figma","https://www.facebook.com/figmadesign","https://www.instagram.com/figma","","","https://www.youtube.com/figmadesign","","https://www.linkedin.com/company/figma ; https://www.linkedin.com/company/earth-dni ; https://www.linkedin.com/company/sadzeppelins ; https://www.linkedin.com/company/maki-studios ; https://www.linkedin.com/company/beamuze ; https://www.linkedin.com/company/craxionstudio ; https://www.linkedin.com/company/nerdfox-design ; https://www.linkedin.com/company/arch-ecosystem ; https://www.linkedin.com/company/kettik","","","","","","TRUE","","","","","","Sectigo RSA Domain Validation Secure Server CA","TLS 1.3","1648339199","","","TRUE","","","","","","Figma","FIGMA DESIGN","Design Services","Figma is a design platform for teams who build products together. Born on the Web, Figma helps teams create, share, test, and ship better designs from start to finish. Whether it’s consolidating tools, simplifying workflows, or collaborating across teams and time zones, Figma makes the design process faster, more efficient, and fun while keeping everyone on the same page.","San Francisco, California ; 760 Market St, San Francisco, California 94103, US","201-500 employees","Privately Held","2012","John Lilly -- Boards, Advising, Teaching ; Devin Foley -- Software Engineer at Figma ; Sho Kuwamoto -- Director of Product ; Mamoon Hamid -- Kleiner Perkins"
"https://www.canva.com","16.13.1","1372504","US","","EN ; EN-US ; ES ; FR ; IT ; IT-it ; NL ; PB ; PL-pl ; PT","simonmg@canva.com","simonmg@canva.com","","","","","https://www.twitter.com/canva","https://www.facebook.com/canva","https://www.instagram.com/canva","","","","https://www.pinterest.com/canva","","","","","© 2021 All Rights Reserved, Canva®","2021","TRUE","","","","","","Cloudflare Inc ECC CA-3","TLS 1.3","1659916799","","","TRUE","","","","","","","CANVA","","","","","","",""
"https://www.npmjs.com","","1233258","","","","","","","","","","","","","","","","","https://www.linkedin.com/company/npm-inc- ; https://www.linkedin.com/company/react-scout ; https://www.linkedin.com/company/reduxie ; https://www.linkedin.com/company/middleman-npm ; https://www.linkedin.com/company/nodexchange ; https://www.linkedin.com/company/gremlin-orm ; https://www.linkedin.com/company/charon-graphql ; https://www.linkedin.com/company/ajv-validator","","","","","","","","","","","","","","","","","","","","","","","npm, Inc.","","Computer Software","Over 10 million software developers worldwide use npm, Inc.’s open source software and web registry to discover, share, and reuse packages of code. Our users download over 800,000 packages more than 7 billion times per week, and registry downloads have grown by more than 16x in the last two years. npm’s paid products and services offer teams and companies ways to organize, share, and secure code, integrate npm with testing and deployment tools, and bring code reuse into the enterprise. More than 150,000 companies, including BBC, Coinbase, eBay, Electronic Arts, Nvidia, and Slack rely on npm to reduce friction and build amazing things.","Oakland, CA ; 1999 Harrison St, Ste 1150, Oakland, CA 94612, US","11-50 employees","Privately Held","2014","C J Silverio -- Distinguished Engineer at Eaze ; Katie Fenn -- Senior Engineer at npm, Inc. ; Elad Ben Shmuel -- Effective code ; Andri Alexandrou -- Web Application Developer"
"https://discord.com","","1186989","","","AR ; DE ; EN ; EN-US ; ES ; FR ; FR-be ; HR ; ID ; IT","abuse@discord.com ; support@discord.com ; arbitration-opt-out@discord.com ; copyright@discord.com ; disputes@discord.com","abuse@discord.com ; support@discord.com ; arbitration-opt-out@discord.com ; copyright@discord.com ; disputes@discord.com","","","","","https://www.twitter.com/discord","","","","","","","","","","","","","TRUE","","","","","","Cloudflare Inc ECC CA-3","TLS 1.3","1671494399","","","TRUE","","","","","","","DISCORD","","","","","","",""
"https://newbedev.com","","1067218","US ; SG","","EN ; ES ; FR ; ID ; NL ; PL-pl ; PT-BR ; RU ; TR ; af","","","","","","","","","","","","","","","","Home - NewBeDev","","© 2021 newbedev","2021","TRUE","WebSite ; SearchAction ; EntryPoint ; WebPage ; ReadAction","","","","","R3","TLS 1.2","1649814795","FALSE","FALSE","TRUE","","","","","","","NEWBEDEV","","","","","","",""
"https://app.hubspot.com","","1049367","","","","","","","","","","","","","","","","","https://www.linkedin.com/company/valor-manufacturing-training ; https://www.linkedin.com/company/growthhackingconsultant","","","","","","FALSE","","","","","","Cloudflare Inc ECC CA-3","TLS 1.3","1656201599","TRUE","TRUE","TRUE","","","","","","Valor Manufacturing Training","CHROMEWEBDATA","Strategic Management Services","Valor Manufacturing Training is an organization dedicated to your employee retention strategy by offering state-of-the-art, standardized and personalized training content and delivery platforms to reduce your costs associated with training and turnover. 2020 changed the world and the manufacturing industry may have been impacted the most. Organizations were forced to change strategies, practices and operating procedures to better protect themselves and their employees. Adaptability has become a key factor to success in the manufacturing sector. Our mission is to ease your adaptability transition pinch-points and bottlenecks. Our strategy and corporate culture are built upon the foundational building blocks of honesty, integrity, inclusion, sustainability and respect. The heart of our mission is to partner with our client-partner organizations to overcome the challenges and barriers on their road to success.","St Joseph, Missouri ; 825 Edmond St, St Joseph, Missouri 64501, US","2-10 employees","Privately Held","2018","Chris Clark -- Marketing, Communications and Engagement Professional ; Sami Atieh -- Manufacturing Skills Training, Education, Tech. ; Lute Atieh, MBA -- We produce state-of-the-art training content and delivery solutions for the manufacturing industry. ; Bernice Brown -- Lead Artist at Valor Manufacturing Training"
"https://app.slack.com","16.14.0","1021679","","","","","","","","","","","","","","","","","","","","","","","FALSE","","Slack Technologies, Inc.","","","San Francisco","DigiCert TLS RSA SHA256 2020 CA1","TLS 1.3","1650326399","TRUE","TRUE","TRUE","","","","","","","Slack Technologies, Inc.","","","","","","",""
"https://www.udemy.com","0581 ; 2557 ; 404 ; 5212 ; 778 ; 884 ; 964","1019261","CA ; US","","EN ; ES ; FR ; GB ; ID ; PT ; SR ; TH ; am ; ar","info@udemy.com ; instructorsupport@udemy.com ; press@udemy.com ; piracy@udemy.com ; notices@udemy.com ; copyright@udemy.com ; privacy@udemy.com ; legal@udemy.com","info@udemy.com ; instructorsupport@udemy.com ; press@udemy.com ; piracy@udemy.com ; notices@udemy.com ; copyright@udemy.com ; privacy@udemy.com ; legal@udemy.com","instructorsupport@udemy.com ; piracy@udemy.com ; notices@udemy.com","","","","","","","","","","","","","","","© 2022 Udemy, Inc.","2022","TRUE","","Udemy Inc.","","","San Francisco","DigiCert TLS RSA SHA256 2020 CA1","TLS 1.3","1664495999","","","TRUE","UA-12366301","","","","","","Udemy Inc.","","","","","","",""
"https://www.paypal.com","0.14.3 ; 0078 ; 1215 ; 16 ; 16.12.0 ; 16.14.0 ; 16.6.3 ; 17 ; 17.0.1","982984","US","","AR ; DE ; DE-DE ; EL ; EN ; EN-US ; ES ; ES-CO ; FR ; IT","ktyers@paypal.com ; fbelavenute@paypal.com ; pablo@paypal.com ; spoof@paypal.com","ktyers@paypal.com ; fbelavenute@paypal.com ; pablo@paypal.com ; spoof@paypal.com","","","","","","","","","","","","","","","","© 1999–2022","2022","TRUE","Organization","PayPal, Inc.","US","Delaware","San Jose","DigiCert SHA2 Extended Validation Server CA","TLS 1.3","1647388799","","","TRUE","","","","","","","PayPal, Inc.","","","","","","",""
"https://fontawesome.com","","982851","US","","EN ; ES ; En ; FR ; FR-fr ; NL ; ar ; ar-DZ ; ar-EG ; ar-SA","hello@fontawesome.com","","","","","","https://www.twitter.com/fontawesome","","","","","","","https://www.linkedin.com/company/fontawesome","","Font Awesome","The world’s most popular and easiest to use icon set just got an upgrade. More icons. More styles. More Options.","","","TRUE","","Fonticons Inc","","","Bentonville","DigiCert TLS RSA SHA256 2020 CA1","TLS 1.3","1639526399","","","TRUE","UA-30136587","","","","","Font Awesome","Fonticons Inc","","Get vector icons and social logos on your website with Font Awesome, the web’s most popular icon set and toolkit.","Bentonville, Arkansas ; 307 S Main St, Bentonville, Arkansas 72712, US","2-10 employees","","","Brian Talbot -- Seasoned Designer + Cookie-Pusher ; Frances Botsford -- ; Mike Wilkerson -- Entrepreneurial engineer, full stack developer, seeking team members for side hustles. ; Dave Gandy -- Founder at Fort Awesome"
"https://www.binance.com","16.13.0 ; 16.14.0","937741","","","EN ; ES ; FR ; FR-fr ; IT ; PT ; PT-BR ; SR ; af ; ar","dual.investment@binance.com ; info@binance.com ; dpo@binance.com","dual.investment@binance.com ; info@binance.com ; dpo@binance.com","dual.investment@binance.com ; dpo@binance.com","","","","https://www.twitter.com/binance","https://www.facebook.com/binance","https://www.instagram.com/Binance","","","https://www.youtube.com/binanceyoutube","","https://www.linkedin.com/company/binanceaustralia ; https://www.linkedin.com/company/bali-hotels-booking-online ; https://www.linkedin.com/company/jc-capital-crypto-group-llc ; https://www.linkedin.com/company/binancehelp-1844-517-3111 ; https://www.linkedin.com/company/rankweek ; https://www.linkedin.com/company/binance ; https://www.linkedin.com/company/workfreelance ; https://www.linkedin.com/company/binanceuk ; https://www.linkedin.com/company/foraybtc ; https://www.linkedin.com/company/tedarikzinciriyonetimi","","","","Binance © 2021","2021","TRUE","Organization ; Person ; ImageObject ; WebSite ; WebPage","Binance Holdings Limited","","","George Town","GeoTrust RSA CA 2018","TLS 1.3","1649332800","","","TRUE","","","","","","Binance Australia","Binance Holdings Limited","Internet Publishing","Binance Australia is Australia's leading blockchain and cryptocurrency infrastructure provider with a financial product suite that includes the largest digital asset exchange by volume. Trusted by over 500,000 Australians - the Binance Australia is dedicated to increasing the freedom of money for users, and features an unmatched portfolio of crypto products & education. For more information, visit: https://www.binance.com/en-AU","Brisbane, QLD ; Brisbane, QLD 4000, AU ; Adelaide, South Australia 5000, AU","11-50 employees","Privately Held","2020","Charis Campbell -- Crypto | DeFi | NFTs | Fintech ; Leigh Travers -- Chief Executive Officer at Binance Australia ; Sam Teoh -- Chief Financial Officer at Binance Australia ; Nicholes Ong -- Operations Specialist at Binance Australia"
"https://pretagteam.com","","839212","","","","","","","","","","","","","","","","","","","","","","","","","","","","","","","","","","TRUE","","","","","","","","","","","","","",""
"https://trello.com","17.0.2 ; 698","700457","US ; DE","","EN ; ES ; FR ; ID ; NL ; am ; ar ; ar-EG ; ar-ae ; ar-us","platform@trello.com","platform@trello.com","","","","","","","","","","","","https://www.linkedin.com/company/siemensgrains ; https://www.linkedin.com/company/lopes-lopes-engenharia ; https://www.linkedin.com/company/diag99-studios ; https://www.linkedin.com/company/xs-minh-ngoc-xosominhngoc-kqxs-xskt-ket-qua-xo-so-minh-ngoc-truc-tiep-hom-nay-nhanh-nhat ; https://www.linkedin.com/company/trello ; https://www.linkedin.com/company/espaço-saúde ; https://www.linkedin.com/company/jackgoldenjob","","","","© Copyright 2022. All rights reserved.","2022","TRUE","","","","","","DigiCert TLS Hybrid ECC SHA384 2020 CA1","TLS 1.3","1677283199","","","TRUE","","","","","","grains – Empowered by purpose in Siemens","TRELLO","Philanthropic Fundraising Services","We are a team of cross-disciplined Siemens professionals who share the purpose of living the changes we want to see. “grains” [greinz] pl, Körner, Saat; is a Siemens network pursuing self-organized work. Encourages, leads and strengthens colleagues to transform Siemens step by step – with all their talents and passions.…for a stronger Siemens. # The grains vision The world will be a better place when we at Siemens… …work intrinsically motivated …trust in and care for each other …are empowered to realize our full potential …collaborate based on a shared purpose Together, we will flourish # grains portfolio • Holacracy Experience Workshop • Purpose Discovery Workshop • Mindfulness@Siemens • Agile Coaching • Ubongo Flow Game • Adaptive leadership workshop • Design Thinking • Systemic Constellation • Flow Working-Kanban • Any further tensions from the business # FAQ • Why do we need grains? Our value is in the realization of our vision. We enable the Siemens transition, step by step, while leading by example and practicing what we suggest. • What do grains do? We devote a good part of our time to drive the change toward the vision and effectively interact with each other (e.g. in grains meetings) to maximize our impact. • Do I need to do more than I do today? Probably not. You can simply prioritize and coordinate your activities to better support the grains purpose and your PMP objectives. • Who decides what grains do? We have a hierarchy of purposes and are empowered to make decisions in our domains. Where needed we use the Integrative Decision Making Process. • Who owns what we produce? Siemens is owner. There is no single owner or sponsor for grains as it is a cross-organizational, self-organized network. We are fully transparent for everyone. • What if I say yes? During the next couple of months you should start (or continue) to work in a grains initiative and another grains will support you in integrating with the network.","Munich, Bavaria ; Werner-von-Siemens-Straße 1, Munich, Bavaria 80333, DE","51-200 employees","Nonprofit","2016","Dipesh Kalian -- Entrepreneur, Business Improvement Manager, Life Coach #transform #lead #change #excellence"
"http://app.asana.com","16.12.0","634724","US","VA","EN ; EN-US ; ES ; ES-ES ; FR-FR ; NL ; RU ; SR ; TR ; ar","","","","","","","","","","","","","","","","","","","","TRUE","","","","","","Amazon","TLS 1.2","1665359999","TRUE","TRUE","TRUE","","","","","","","APP.ASANA","","","","","","",""
"https://qiita.com","","630415","","","","","","","","","","","","","","","","","","","","","","","","","","","","","","","","","","TRUE","","","","","","","","","","","","","",""
"https://www.quora.com","","627327","CA ; SE","","DE-DE ; EN ; En ; ID ; NL ; SR ; ar ; ar-AE ; ar-AR ; ar-JO","","","","","","","","","","","","","","","","","","","","FALSE","","","","","","R3","TLS 1.3","1651546811","","","TRUE","","","","","","","QUORA","","","","","","",""
"https://open.spotify.com","","621721","US","CA","DE ; EN ; ES ; FR ; ID ; NL ; PT ; PT-BR ; PT-br ; TH","","","","","","","","","","","","","","","","Spotify - Web Player: Music for everyone","Spotify is a digital music service that gives you access to millions of songs.","","","FALSE","","Spotify AB","","","Stockholm","DigiCert TLS RSA SHA256 2020 CA1","TLS 1.3","1651622399","TRUE","TRUE","TRUE","","","","","","","Spotify AB","","","","","","",""
"https://unsplash.com","","621573","US ; CA","","EN ; EN-US ; ES ; FR ; Fa-IR ; NL ; ar ; ar-AR ; ar-EG ; ar-TN","support@unsplash.com ; abuse@unsplash.com ; privacy@unsplash.com ; abuse@unsplash.com ; api@unsplash.com ; support@unsplash.com ; partnerships@unsplash.com ; privacy@unsplash.com","abuse@unsplash.com ; api@unsplash.com ; support@unsplash.com ; partnerships@unsplash.com ; privacy@unsplash.com","","","","","https://www.twitter.com/unsplash","","https://www.instagram.com/unsplash","","","","","https://www.linkedin.com/company/unsplash ; https://www.linkedin.com/company/lovenoricreations ; https://www.linkedin.com/company/jo-fotografía","","Beautiful Free Images & Pictures | Unsplash","Beautiful, free images and photos that you can download and use for any project. Better than any royalty free or stock photos.","","","TRUE","","","","","","GlobalSign Atlas R3 DV TLS CA H2 2021","TLS 1.2","1674665085","TRUE","TRUE","TRUE","UA-36049670","","","","","Unsplash","UNSPLASH","Computer Software","In 2013, Unsplash launched as a modest Tumblr blog. Since then, Unsplash has evolved into one of the most impactful online communities. Today, over 10 billion Unsplash images are seen every month. A photo featured on Unsplash will now be viewed more than the front page of The New York Times. The Unsplash community is fueled by contributors who offer their images freely for anyone to use, inspiring hundreds of millions of creators from 13-year-old graphic designers to multi-platinum recording artists. Unsplash is a special community, where the powerful principles of sharing and openness have taken the place of strict copyright and legal red tape. The web was meant to connect, inform, and inspire us in unprecedented ways. The Unsplash community embodies this philosophy fully. Unsplash has become a place where the impact of our connected world is on full display. Instead of images being hoarded and shut down, images on Unsplash are fuel for creativity. At Unsplash, our mission is to enable everyone to create. You don’t need to know someone, or have an agent, or have a name to be great on Unsplash. We're a place where creators meet their audience. A place where individuals become a community. And a source of inspiration for millions of people from every country in the world. We’ve seen how the willingness to give a single image unlocks the creative potential that exists in us all.","Montreal, Quebec ; 400 Rue McGill, 5th Floor, Montreal, Quebec H2Y 2G1, CA","11-50 employees","Privately Held","2013","Chantal Garnier 🖊️ Content Marketing -- Brand & Product Content | Future Of Work | BtoB | Startups | Tech | Innovation | Growth Hacking | PlanningStrat-Station | ex Microsoft (FR) & EIT… ; Francesco Ungaro -- Strategy & Presentation Consultant ; Nicholas Pardon -- Entrepreneur, investor, and curator ; Roberta Doyle -- Software Developer at Unsplash"
"https://wetransfer.com","","604927","IE","L","DE ; EN ; EN-US ; ES ; ES-ES ; FR ; IT ; NL ; PL ; PT","developers@wetransfer.com","developers@wetransfer.com","","","","","","","","","","","","","","","","","","TRUE","","","","","","Amazon","TLS 1.2","1662335999","","","TRUE","","","","","","","WETRANSFER","","","","","","",""
"http://dash.cloudflare.com","","572295","","","","","","","","","","","","","","","","","","","","","","","","","","","","","","","","","","TRUE","","","","","","","","","","","","","",""
